{
  "$schema": "https://json-schema.org/draft/2020-12/schema",
  "$id": "https://raw.githubusercontent.com/api-evangelist/gzw-data/refs/heads/main/json-schema/gzw-data-ObjectResponse.json",
  "title": "ObjectResponse",
  "description": "Envelope/shared schema \u2014 derived verbatim from components.schemas.ObjectResponse of the provider's published OpenAPI 3.0.3 (4.2.0) at https://gzw-data.dev/api/v1/spec. Field set is generated by the provider from observed data, so it tracks the weekly wiki scrape.",
  "type": "object",
  "required": [
    "data",
    "source",
    "timestamp"
  ],
  "properties": {
    "data": {},
    "source": {
      "type": "string"
    },
    "timestamp": {
      "type": "string",
      "format": "date-time"
    },
    "dataVersion": {
      "type": "string"
    },
    "apiVersion": {
      "type": "string",
      "example": "v1"
    },
    "implementationVersion": {
      "type": "string",
      "example": "4.2.0"
    }
  },
  "additionalProperties": true
}