{"data":{"name":"vendors","file":"vendors.json","itemCount":7,"fields":{"full_name":{"types":["string"],"presentCount":7,"optional":false,"nullable":false,"example":"Anton Jackson"},"id":{"types":["string"],"presentCount":7,"optional":false,"nullable":false,"example":"artisan"},"image":{"types":["string"],"presentCount":7,"optional":false,"nullable":false,"example":"https://static.wikia.nocookie.net/gray-zone-warfare/images/0/09/Gunny_square.png/revision/latest/scale-to-width-down/268?cb=20240502171554"},"name":{"types":["string"],"presentCount":7,"optional":false,"nullable":false,"example":"Artisan"},"wares":{"types":["string"],"presentCount":1,"optional":true,"nullable":false,"example":"Any"}},"lastScrapedAt":"2026-08-31T13:22:10.500330Z","capabilities":{"operations":["list","get","filter","sort","paginate"],"filters":{"supported":true,"fields":["full_name","id","image","name","wares"]},"sorting":{"supported":true,"fields":["full_name","id","image","name","wares"],"directions":["asc","desc"]},"counts":{"supported":true,"includesTotal":true,"includesPageCount":true}}},"source":"GZW Data API","timestamp":"2026-09-03T13:05:32.709Z","dataVersion":"2026-08-31T13:22:10.500330Z"}