{"data":{"item":{"name":"Advanced Tracking Tag","id":"advanced-tracking-tag","weight":"0,014kg","sold_by":"Banshee R.3","grid_size":"1x1","duration":"12h","manufacturer":"General West","sell_price":"$269","buy_price":"$899","image":"https://static.wikia.nocookie.net/gray-zone-warfare/images/a/a5/Advanced_Tracking_Tag.png/revision/latest?cb=20250523224603"},"vendors":[{"name":"Banshee","id":"banshee","full_name":"James Miller","image":"https://static.wikia.nocookie.net/gray-zone-warfare/images/5/55/Vendor-Banshee.png/revision/latest/scale-to-width-down/268?cb=20240505160347"}],"references":[],"referenceCount":0,"note":"References are exact or textual matches found in the current datasets; they are not guaranteed gameplay relationships."},"source":"GZW Data API","timestamp":"2026-09-03T13:05:17.853Z","dataVersion":"2026-08-31T13:22:10.500330Z"}