{"data":{"name":"AK-12","id":"ak-12","type":"Assault Rifle","weight":"3.553 kg","sold_by":"Turncoat R.2","manufacturer":"Kalashnikov Concern","accuracy":"2.81 MOA","fire_mode":"Single/Full-auto","fire_rate":"700 RPM","caliber":"5.45x39mm","accepted_ammunition":"5.45x39mm BP (7N22) 5.45x39mm BS (7N24) 5.45x39mm BT (7BT4) 5.45x39mm FMJ 5.45x39mm HP 5.45x39mm PP (7N10) 5.45x39mm PS (7N6) 5.45x39mm US (7U1)","image":"https://static.wikia.nocookie.net/gray-zone-warfare/images/3/30/AK-12_inspect.png/revision/latest/scale-to-width-down/268?cb=20250602231732"},"source":"GZW Data API","timestamp":"2026-09-03T13:05:05.607Z","dataVersion":"2026-08-31T13:22:10.500330Z"}