{"data":{"api":"GZW Data API","apiVersion":"v1","implementationVersion":"4.2.0","baseUrl":"https://gzw-data.dev/api/v1","openapi":"https://gzw-data.dev/api/v1/spec","dataVersion":"2026-08-31T13:22:10.500330Z","snapshot":{"snapshotId":"73ba905251e5c5e1","version":"2026-08-31T13:22:10.500330Z","capturedAt":"2026-08-31T13:22:10.500330Z","datasets":{"ammo":79,"apparel_items":63,"auxiliary":5,"backpacks":16,"barrels":28,"belts":8,"binoculars":4,"boots":6,"buffer_tubes":3,"charging_handle":11,"cleanup":4,"collimators":20,"containers":28,"contract":26,"contracts":3,"drinks":18,"electronics":5,"face_cover":4,"food":19,"foregrips":19,"front_iron_sights":16,"funds":4,"gas_blocks":9,"gear":26,"glasses":13,"gloves":12,"handguards":56,"headsets":7,"helmet_mounts":3,"helmets":41,"hidden_task":7,"household_item":20,"intels":5,"items":3,"jewellery":17,"keycards":8,"keys":126,"laboratory_supplies":9,"lockboxes":3,"loot_container":39,"loot_containers":4,"loot_items":120,"magazines":51,"main_task":26,"medical":34,"military_equipment":19,"military_material":4,"mortar_rounds":3,"mounts":53,"muzzle_devices":45,"night_vision":5,"paper":1,"pistol_grips":25,"plate_carrier":1,"plate_carriers":16,"provisions":37,"reading_intel":1,"rear_iron_sights":20,"removed_content":24,"repair_kits":6,"rigs":11,"scopes":11,"shirts":20,"side_task":96,"slides":12,"squad_strike_missions":32,"squad_strike_missions_item":55,"stock_adapters":10,"stocks":58,"suppressors":23,"tactical_devices":11,"task_items":101,"tasks":249,"throwables":8,"tools":8,"trousers":23,"upcoming_content":11,"upper_receivers":15,"valuables":1,"vendors":7,"vests":19,"vices":11,"weapon_parts":1,"weapons":44,"workshop_supplies":16}},"historyCount":2,"datasetCount":85,"datasets":["ammo","apparel_items","auxiliary","backpacks","barrels","belts","binoculars","boots","buffer_tubes","charging_handle","cleanup","collimators","containers","contract","contracts","drinks","electronics","face_cover","food","foregrips","front_iron_sights","funds","gas_blocks","gear","glasses","gloves","handguards","headsets","helmet_mounts","helmets","hidden_task","household_item","intels","items","jewellery","keycards","keys","laboratory_supplies","lockboxes","loot_container","loot_containers","loot_items","magazines","main_task","medical","military_equipment","military_material","mortar_rounds","mounts","muzzle_devices","night_vision","paper","pistol_grips","plate_carrier","plate_carriers","provisions","reading_intel","rear_iron_sights","removed_content","repair_kits","rigs","scopes","shirts","side_task","slides","squad_strike_missions","squad_strike_missions_item","stock_adapters","stocks","suppressors","tactical_devices","task_items","tasks","throwables","tools","trousers","upcoming_content","upper_receivers","valuables","vendors","vests","vices","weapon_parts","weapons","workshop_supplies"],"source":"https://github.com/ZoniBoy00/gzw-data"},"source":"GZW Data API","timestamp":"2026-09-03T13:00:26.371Z","dataVersion":"2026-08-31T13:22:10.500330Z"}