{"data":{"current":{"snapshotId":"73ba905251e5c5e1","version":"2026-08-31T13:22:10.500330Z","capturedAt":"2026-08-31T13:22:10.500330Z","datasets":{"ammo":79,"apparel_items":63,"auxiliary":5,"backpacks":16,"barrels":28,"belts":8,"binoculars":4,"boots":6,"buffer_tubes":3,"charging_handle":11,"cleanup":4,"collimators":20,"containers":28,"contract":26,"contracts":3,"drinks":18,"electronics":5,"face_cover":4,"food":19,"foregrips":19,"front_iron_sights":16,"funds":4,"gas_blocks":9,"gear":26,"glasses":13,"gloves":12,"handguards":56,"headsets":7,"helmet_mounts":3,"helmets":41,"hidden_task":7,"household_item":20,"intels":5,"items":3,"jewellery":17,"keycards":8,"keys":126,"laboratory_supplies":9,"lockboxes":3,"loot_container":39,"loot_containers":4,"loot_items":120,"magazines":51,"main_task":26,"medical":34,"military_equipment":19,"military_material":4,"mortar_rounds":3,"mounts":53,"muzzle_devices":45,"night_vision":5,"paper":1,"pistol_grips":25,"plate_carrier":1,"plate_carriers":16,"provisions":37,"reading_intel":1,"rear_iron_sights":20,"removed_content":24,"repair_kits":6,"rigs":11,"scopes":11,"shirts":20,"side_task":96,"slides":12,"squad_strike_missions":32,"squad_strike_missions_item":55,"stock_adapters":10,"stocks":58,"suppressors":23,"tactical_devices":11,"task_items":101,"tasks":249,"throwables":8,"tools":8,"trousers":23,"upcoming_content":11,"upper_receivers":15,"valuables":1,"vendors":7,"vests":19,"vices":11,"weapon_parts":1,"weapons":44,"workshop_supplies":16}},"latest":{"snapshotId":"73ba905251e5c5e1","version":"2026-08-31T13:22:10.500330Z","capturedAt":"2026-08-31T13:22:10.500330Z","datasets":{"ammo":79,"apparel_items":63,"auxiliary":5,"backpacks":16,"barrels":28,"belts":8,"binoculars":4,"boots":6,"buffer_tubes":3,"charging_handle":11,"cleanup":4,"collimators":20,"containers":28,"contract":26,"contracts":3,"drinks":18,"electronics":5,"face_cover":4,"food":19,"foregrips":19,"front_iron_sights":16,"funds":4,"gas_blocks":9,"gear":26,"glasses":13,"gloves":12,"handguards":56,"headsets":7,"helmet_mounts":3,"helmets":41,"hidden_task":7,"household_item":20,"intels":5,"items":3,"jewellery":17,"keycards":8,"keys":126,"laboratory_supplies":9,"lockboxes":3,"loot_container":39,"loot_containers":4,"loot_items":120,"magazines":51,"main_task":26,"medical":34,"military_equipment":19,"military_material":4,"mortar_rounds":3,"mounts":53,"muzzle_devices":45,"night_vision":5,"paper":1,"pistol_grips":25,"plate_carrier":1,"plate_carriers":16,"provisions":37,"reading_intel":1,"rear_iron_sights":20,"removed_content":24,"repair_kits":6,"rigs":11,"scopes":11,"shirts":20,"side_task":96,"slides":12,"squad_strike_missions":32,"squad_strike_missions_item":55,"stock_adapters":10,"stocks":58,"suppressors":23,"tactical_devices":11,"task_items":101,"tasks":249,"throwables":8,"tools":8,"trousers":23,"upcoming_content":11,"upper_receivers":15,"valuables":1,"vendors":7,"vests":19,"vices":11,"weapon_parts":1,"weapons":44,"workshop_supplies":16}},"previous":{"snapshotId":null,"version":"2026-08-25T11:12:54.629187Z","capturedAt":"2026-08-25T11:12:54.629187Z","datasets":{"ammo":79,"apparel_items":63,"auxiliary":5,"backpacks":16,"barrels":28,"belts":8,"binoculars":4,"boots":6,"buffer_tubes":3,"charging_handle":11,"cleanup":4,"collimators":20,"containers":28,"contract":26,"contracts":3,"drinks":18,"electronics":5,"face_cover":4,"food":19,"foregrips":19,"front_iron_sights":16,"funds":4,"gas_blocks":9,"gear":26,"glasses":13,"gloves":12,"handguards":56,"headsets":7,"helmet_mounts":3,"helmets":41,"hidden_task":7,"household_item":20,"intels":5,"items":3,"jewellery":17,"keycards":8,"keys":126,"laboratory_supplies":9,"lockboxes":3,"loot_container":39,"loot_containers":4,"loot_items":120,"magazines":51,"main_task":26,"medical":34,"military_equipment":19,"military_material":4,"mortar_rounds":3,"mounts":53,"muzzle_devices":45,"night_vision":5,"paper":1,"pistol_grips":25,"plate_carrier":1,"plate_carriers":16,"provisions":37,"reading_intel":1,"rear_iron_sights":20,"removed_content":24,"repair_kits":6,"rigs":11,"scopes":11,"shirts":20,"side_task":96,"slides":12,"squad_strike_missions":32,"squad_strike_missions_item":55,"stock_adapters":10,"stocks":58,"suppressors":23,"tactical_devices":11,"task_items":101,"tasks":249,"throwables":8,"tools":8,"trousers":23,"upcoming_content":11,"upper_receivers":15,"valuables":1,"vendors":7,"vests":19,"vices":11,"weapon_parts":1,"weapons":44,"workshop_supplies":16}},"historyCount":2,"hasHistory":true,"changes":{"datasets":[],"added":[],"removed":[]},"message":"Changes are calculated from the latest stored snapshot."},"source":"GZW Data API","timestamp":"2026-09-03T13:00:26.464Z","dataVersion":"2026-08-31T13:22:10.500330Z"}