{"data":{"name":"weapons","file":"weapons.json","itemCount":44,"fields":{"accepted_ammunition":{"types":["string"],"presentCount":43,"optional":true,"nullable":false,"example":".222 Remington SP .222 Remington HP .222 Remington FMJ .222 Remington VMax"},"accuracy":{"types":["string"],"presentCount":33,"optional":true,"nullable":false,"example":"0.8 MOA"},"caliber":{"types":["string"],"presentCount":42,"optional":true,"nullable":false,"example":".222 Remington"},"default_ammo":{"types":["string"],"presentCount":3,"optional":true,"nullable":false,"example":"5.45x39mm FMJ"},"default_mag":{"types":["string"],"presentCount":1,"optional":true,"nullable":false,"example":"DD 5.56x45mm/.300 BLK 32-Round Magazine"},"ergonomics":{"types":["string"],"presentCount":6,"optional":true,"nullable":false,"example":"+15.0%"},"fire_mode":{"types":["string"],"presentCount":38,"optional":true,"nullable":false,"example":"????"},"fire_rate":{"types":["string"],"presentCount":33,"optional":true,"nullable":false,"example":"20 RPM"},"grid_size":{"types":["string"],"presentCount":1,"optional":true,"nullable":false,"example":"2x1"},"id":{"types":["string"],"presentCount":44,"optional":false,"nullable":false,"example":"ak-12"},"image":{"types":["string"],"presentCount":37,"optional":true,"nullable":false,"example":"https://static.wikia.nocookie.net/gray-zone-warfare/images/0/00/SA_vz._58_inspect.png/revision/latest/scale-to-width-down/267?cb=20260602022249"},"manufacturer":{"types":["string"],"presentCount":30,"optional":true,"nullable":false,"example":"????"},"muzzle_device_efficiency":{"types":["string"],"presentCount":4,"optional":true,"nullable":false,"example":"+10.0 %"},"muzzle_velocity":{"types":["string"],"presentCount":1,"optional":true,"nullable":false,"example":"+0.8%"},"name":{"types":["string"],"presentCount":44,"optional":false,"nullable":false,"example":"AK-12"},"recoil_control":{"types":["string"],"presentCount":6,"optional":true,"nullable":false,"example":"+16%"},"reload_speed":{"types":["string"],"presentCount":11,"optional":true,"nullable":false,"example":"+2%"},"slot":{"types":["string"],"presentCount":8,"optional":true,"nullable":false,"example":"Primary"},"sold_by":{"types":["string"],"presentCount":29,"optional":true,"nullable":false,"example":"???"},"type":{"types":["string"],"presentCount":43,"optional":true,"nullable":false,"example":"Assault Rifle"},"weapon_handling":{"types":["string"],"presentCount":1,"optional":true,"nullable":false,"example":"+10%"},"weight":{"types":["string"],"presentCount":33,"optional":true,"nullable":false,"example":"0.810 kg"}},"lastScrapedAt":"2026-08-31T13:22:10.500330Z","capabilities":{"operations":["list","get","filter","sort","paginate"],"filters":{"supported":true,"fields":["accepted_ammunition","accuracy","caliber","default_ammo","default_mag","ergonomics","fire_mode","fire_rate","grid_size","id","image","manufacturer","muzzle_device_efficiency","muzzle_velocity","name","recoil_control","reload_speed","slot","sold_by","type","weapon_handling","weight"]},"sorting":{"supported":true,"fields":["accepted_ammunition","accuracy","caliber","default_ammo","default_mag","ergonomics","fire_mode","fire_rate","grid_size","id","image","manufacturer","muzzle_device_efficiency","muzzle_velocity","name","recoil_control","reload_speed","slot","sold_by","type","weapon_handling","weight"],"directions":["asc","desc"]},"counts":{"supported":true,"includesTotal":true,"includesPageCount":true}}},"source":"GZW Data API","timestamp":"2026-09-03T13:00:26.608Z","dataVersion":"2026-08-31T13:22:10.500330Z"}