{"data":{"query":"ak-12","results":{"gear":[{"name":"Weapons","id":"weapons","image":"https://static.wikia.nocookie.net/gray-zone-warfare/images/3/30/AK-12_inspect.png/revision/latest/scale-to-width-down/200?cb=20250602231732"}],"rear_iron_sights":[{"name":"AK-12 Rear sight","id":"ak-12-rear-sight","type":"Rear Iron Sight","weight":"0.060 kg","sold_by":"Artisan R.3 Turncoat R.2","buy_price":"$41","manufacturer":"Kalashnikov concern","magnification":"1xx","sighting_range":"800m","image":"https://static.wikia.nocookie.net/gray-zone-warfare/images/4/46/AK12_Rear_inspect.png/revision/latest/scale-to-width-down/267?cb=20250615190605"}],"suppressors":[{"name":"AK-12 Suppressor","id":"ak-12-suppressor","type":"Suppressor","weight":"0.620 kg","sold_by":"Turncoat R.3","buy_price":"$1,160","manufacturer":"Rotor 43","weapon_handling":"-2 %","accuracy_modifier":"+3 %","loudness_reduction":"+18 %","muzzle_device_efficiency":"+5 %","size_change_horizontal":"+1"}],"weapons":[{"name":"AK-12","id":"ak-12","type":"Assault Rifle","weight":"3.553 kg","sold_by":"Turncoat R.2","manufacturer":"Kalashnikov Concern","accuracy":"2.81 MOA","fire_mode":"Single/Full-auto","fire_rate":"700 RPM","caliber":"5.45x39mm","accepted_ammunition":"5.45x39mm BP (7N22) 5.45x39mm BS (7N24) 5.45x39mm BT (7BT4) 5.45x39mm FMJ 5.45x39mm HP 5.45x39mm PP (7N10) 5.45x39mm PS (7N6) 5.45x39mm US (7U1)","image":"https://static.wikia.nocookie.net/gray-zone-warfare/images/3/30/AK-12_inspect.png/revision/latest/scale-to-width-down/268?cb=20250602231732"}]},"datasets":["ammo","apparel_items","auxiliary","backpacks","barrels","belts","binoculars","boots","buffer_tubes","charging_handle","cleanup","collimators","containers","contract","contracts","drinks","electronics","face_cover","food","foregrips","front_iron_sights","funds","gas_blocks","gear","glasses","gloves","handguards","headsets","helmet_mounts","helmets","hidden_task","household_item","intels","items","jewellery","keycards","keys","laboratory_supplies","lockboxes","loot_container","loot_containers","loot_items","magazines","main_task","medical","military_equipment","military_material","mortar_rounds","mounts","muzzle_devices","night_vision","paper","pistol_grips","plate_carrier","plate_carriers","provisions","reading_intel","rear_iron_sights","removed_content","repair_kits","rigs","scopes","shirts","side_task","slides","squad_strike_missions","squad_strike_missions_item","stock_adapters","stocks","suppressors","tactical_devices","task_items","tasks","throwables","tools","trousers","upcoming_content","upper_receivers","valuables","vendors","vests","vices","weapon_parts","weapons","workshop_supplies"],"fields":[],"fuzzy":false,"limit":2},"source":"GZW Data API","timestamp":"2026-09-03T13:05:05.512Z","dataVersion":"2026-08-31T13:22:10.500330Z"}